ReviewVenue,PublicationVenue,Title,Authors,AuthorPDF,Abstract,ExplanationPage,SourceMaterials,Data,Video,DOI,PublicationYear,ConferenceYear,ConferenceTrack,ConferenceRoom,ConferenceDay,ConferenceSession,ConferenceTimeStart,ConferenceTimeEnd
VAST,TVCG,Sequence Synopsis: Optimize Visual Summary of Temporal Event Data,"Yuanzhe Chen, Panpan Xu, Liu Ren",http://lliquid.github.io/homepage/files/ss_vast17.pdf,"Event sequences analysis plays an important role in many application domains such as customer behavior analysis, electronic health record analysis and vehicle fault diagnosis. Real-world event sequence data is often noisy and complex with high event cardinality, making it a challenging task to construct concise yet comprehensive overviews for such data. In this paper, we propose a novel visualization technique based on the minimum description length (MDL) principle to construct a coarse-level overview of event sequence data while balancing the information loss in it. The method addresses a fundamental trade-off in visualization design: reducing visual clutter vs. increasing the information content in a visualization. The method enables simultaneous sequence clustering and pattern extraction and is highly tolerant to noises such as missing or additional events in the data. Based on this approach we propose a visual analytics framework with multiple levels-of-detail to facilitate interactive data exploration. We demonstrate the usability and effectiveness of our approach through case studies with two real-world datasets. One dataset showcases a new application domain for event sequence visualization, i.e., fault development path analysis in vehicles for predictive maintenance. We also discuss the strengths and limitations of the proposed method based on user feedback.",,http://lliquid.github.io/homepage/files/ss_vast17_sup.pdf,,vimeo 230830645,,2018,2017,VAST,301-C,Wednesday,Sequences and Events,2:00 PM,2:20 PM
VAST,TVCG,SkyLens: Visual Analysis of Skyline on Multi-dimensional Data,"Xun Zhao, Yanhong Wu, Weiwei Cui, Xinnan Du, Yuan Chen, Yong Wang, Dik-Lun Lee, Huamin Qu",http://yhwu.me/publications/skylens_vast17.pdf,"Skyline queries have wide-ranging applications in fields that involve multi-criteria decision making, including tourism, retail industry, and human resources. By automatically removing incompetent candidates, skyline queries allow users to focus on a subset of superior data items (i.e., the skyline), thus reducing the decision-making overhead. However, users are still required to interpret and compare these superior items manually before making a successful choice. This task is challenging because of two issues. First, people usually have fuzzy, unstable, and inconsistent preferences when presented with multiple candidates. Second, skyline queries do not reveal the reasons for the superiority of certain skyline points in a multi-dimensional space. To address these issues, we propose SkyLens, a visual analytic system aiming at revealing the superiority of skyline points from different perspectives and at different scales to aid users in their decision making. Two scenarios demonstrate the usefulness of SkyLens on two datasets with a dozen of attributes. A qualitative study is also conducted to show that users can efficiently accomplish skyline understanding and comparison tasks with SkyLens.",,,,vimeo 230829927,,2018,2017,VAST,301-C,Wednesday,High-dimensional Data,9:10 AM,9:30 AM
VAST,TVCG,SOMFlow: Guided Exploratory Cluster Analysis with Self-Organizing Maps and Analytic Provenance,"Dominik Sacha, Matthias Kraus, Jürgen Bernard, Michael Behrisch, Tobias Schreck, Yuki Asano, Daniel Keim",,,,,,,,2018,2017,VAST,301-C,Thursday,ML2: Cluster Analysis,4:35 PM,4:55 PM
VAST,TVCG,Supporting Handoff in Asynchronous Collaborative Sensemaking Using Knowledge-Transfer Graphs,"Jian Zhao, Michael Glueck, Petra Isenberg, Fanny Chevalier, Azam Khan",,"During asynchronous collaborative analysis, handoff of partial findings is challenging because externalizations produced by analysts may not adequately communicate their investigative process. To address this challenge, we developed techniques to automatically capture and help encode tacit aspects of the investigative process based on an analyst’s interactions, and streamline explicit authoring of handoff annotations. We designed our techniques to mediate awareness of analysis coverage, support explicit communication of progress and uncertainty with annotation, and implicit communication through playback of investigation histories. To evaluate our techniques, we developed an interactive visual analysis system, KTGraph, that supports an asynchronous investigative document analysis task. We conducted a two-phase user study to characterize a set of handoff strategies and to compare investigative performance with and without our techniques. The results suggest that our techniques promote the use of more effective handoff strategies, help increase an awareness of prior investigative process and insights, as well as improve final investigative outcomes.",,,,youtube 5iEyczTOvxQ,10.1109/TVCG.2017.2745279,2018,2017,VAST,207,Thursday,Sensemaking,4:55 PM,5:15 PM
VAST,TVCG,The Interactive Visualization Gap in Initial Exploratory Data Analysis,"Andrea Batch, Niklas Elmqvist",http://www.umiacs.umd.edu/~elm/projects/visgap/visgap.pdf,"Data scientists and other analytic professionals often use interactive visualization in the dissemination phase at the end of a workflow during which findings are communicated to a wider audience. Visualization scientists, however, hold that interactive representation of data can also be used during exploratory analysis itself. Since the use of interactive visualization is optional rather than mandatory, this leaves a “visualization gap” during initial exploratory analysis that is the onus of visualization researchers to fill. In this paper, we explore areas where visualization would be beneficial in applied research by conducting a design study using a novel variation on contextual inquiry conducted with professional data analysts. Based on these interviews and experiments, we propose a set of interactive initial exploratory visualization guidelines which we believe will promote adoption by this type of user.",,,,vimeo 230830233,10.1109/TVCG.2017.2743990,2018,2017,VAST,301-C,Thursday,Theory and Analysis Process,11:50 AM,12:10 PM
VAST,TVCG,Towards a Systematic Combination of Dimension Reduction and Clustering in Visual Analytics,"John Wenskovitch, Ian Crandell, Naren Ramakrishnan, Leanna House, Scotland Leman, Chris North",https://infovis.cs.vt.edu/sites/default/files/systematic-combination-dimension.pdf,"Dimension reduction algorithms and clustering algorithms are both frequently used techniques in visual analytics. Both families of algorithms assist analysts in performing related tasks regarding the similarity of observations and finding groups in datasets. Though initially used independently, recent works have incorporated algorithms from each family into the same visualization systems. However, these algorithmic combinations are often ad hoc or disconnected, working independently and in parallel rather than integrating some degree of interdependence. A number of design decisions must be addressed when employing dimension reduction and clustering algorithms concurrently in a visualization system, including the selection of each algorithm, the order in which they are processed, and how to present and interact with the resulting projection. This paper contributes an overview of combining dimension reduction and clustering into a visualization system, discussing the challenges inherent in developing a visualization system that makes use of both families of algorithms.",,,,vimeo 230830954,,2018,2017,VAST,301-C,Thursday,ML2: Cluster Analysis,4:55 PM,5:15 PM
VAST,TVCG,TreePOD: Sensitivity-Aware Selection of Pareto-Optimal Decision Trees,"Thomas Mühlbacher, Lorenz Linhardt, Torsten Möller, Harald Piringer",http://eprints.cs.univie.ac.at/5263/1/treepod.pdf,"Balancing accuracy gains with other objectives such as interpretability is a key challenge when building decision trees. However, this process is difficult to automate because it involves know-how about the domain as well as the purpose of the model. This paper presents TreePOD, a new approach for sensitivity-aware model selection along trade-offs. TreePOD is based on exploring a large set of candidate trees generated by sampling the parameters of tree construction algorithms. Based on this set, visualizations of quantitative and qualitative tree aspects provide a comprehensive overview of possible tree characteristics. Along trade-offs between two objectives, TreePOD provides efficient selection guidance by focusing on Pareto-optimal tree candidates. TreePOD also conveys the sensitivities of tree characteristics on variations of selected parameters by extending the tree generation process with a full-factorial sampling. We demonstrate how TreePOD supports a variety of tasks involved in decision tree selection and describe its integration in a holistic workflow for building and selecting decision trees. For evaluation, we illustrate a case study for predicting critical power grid states, and we report qualitative feedback from domain experts in the energy sector. This feedback suggests that TreePOD enables users with and without statistical background a confident and efficient identification of suitable decision trees.",,,,youtube a3QC3crIsxc,,2018,2017,VAST,102-ABC,Friday,ML3: Classification,9:30 AM,9:50 AM
VAST,TVCG,Understanding a sequence of sequences: Visual exploration of categorical states in lake sediment cores,"Andrea Unger, Nadine Dräger, Mike Sips, Dirk Lehmann",http://46.38.235.241/webpage/dirkfiles/publications/Lehmann_2017_TVCG2_VAST.pdf,"This design study focuses on the analysis of a time sequence of categorical sequences. Such data is relevant for the geoscientific research field of landscape and climate development. It results from microscopic analysis of lake sediment cores. The goal is to gain hypotheses about landscape evolution and climate conditions in the past. To this end, geoscientists identify which categorical sequences are similar in the sense that they indicate similar conditions. Categorical sequences are similar if they have similar meaning (semantic similarity) and appear in similar time periods (temporal similarity). For data sets with many different categorical sequences, the task to identify similar sequences becomes a challenge. Our contribution is a tailored visual analysis concept that effectively supports the analytical process. Our visual interface comprises coupled visualizations of semantics and temporal context for the exploration and assessment of the similarity of categorical sequences. Integrated automatic methods reduce the analytical effort substantially. They (1) extract unique sequences in the data and (2) rank sequences by a similarity measure during the search for similar sequences. We evaluated our concept by demonstrations of our prototype to a larger audience and hands-on analysis sessions for two different lakes. According to geoscientists, our approach fills an important methodological gap in the application domain",,,,youtube upjkAJTgVXI,,2018,2017,VAST,301-C,Wednesday,Sequences and Events,3:20 PM,3:40 PM
VAST,TVCG,Understanding the Relationship between Interactive Optimisation and Visual Analytics in the Context of Prostate Brachytherapy,"Jie Liu, Tim Dwyer, Kim Marriott, Jeremy Millar, Annette Haworth",,"The fields of operations research and computer science have long sought to find automatic solver techniques that can find high-quality solutions to difficult real-world optimisation problems. The traditional workflow is to exactly model the problem and then enter this model into a general-purpose &#x201C;black-box&#x201D; solver. In practice, however, many problems cannot be solved completely automatically, but require a &#x201C;human-in-the-loop&#x201D; to iteratively refine the model and give hints to the solver. In this paper, we explore the parallels between this interactive optimisation workflow and the visual analytics sense-making loop. We assert that interactive optimisation is essentially a visual analytics task and propose a problem-solving loop analogous to the sense-making loop. We explore these ideas through an in-depth analysis of a use-case in prostate brachytherapy, an application where interactive optimisation may be able to provide significant assistance to practitioners in creating prostate cancer treatment plans customised to each patient&#x0027;s tumour characteristics. However, current brachytherapy treatment planning is usually a careful, mostly manual process involving multiple professionals. We developed a prototype interactive optimisation tool for brachytherapy that goes beyond current practice in supporting focal therapy - targeting tumour cells directly rather than simply seeking coverage of the whole prostate gland. We conducted semi-structured interviews, in two stages, with seven radiation oncology professionals in order to establish whether they would prefer to use interactive optimisation for treatment planning and whether such a tool could improve their trust in the novel focal therapy approach and in machine generated solutions to the problem.",,,,,10.1109/TVCG.2017.2744418,2018,2017,VAST,301-C,Thursday,Interaction in the Analysis Process,3:00 PM,3:20 PM
VAST,TVCG,VIGOR: Interactive Visual Exploration of Graph Query Results,"Robert Pienta, Fred Hohman, Alex Endert, Acar Tamersoy, Kevin Roundy, Chris Gates, Shamkant Navathe, Duen Horng Chau",https://www.cc.gatech.edu/~dchau/papers/17-vast-vigor.pdf,"Finding patterns in graphs has become a vital challenge in many domains from biological systems, network security, to finance (e.g., finding money laundering rings of bankers and business owners). While there is significant interest in graph databases and querying techniques, less research has focused on helping analysts make sense of underlying patterns within a group of subgraph results. Visualizing graph query results is challenging, requiring effective summarization of a large number of subgraphs, each having potentially shared node-values, rich node features, and flexible structure across queries. We present VIGOR, a novel interactive visual analytics system, for exploring and making sense of query results. VIGOR uses multiple coordinated views, leveraging different data representations and organizations to streamline analysts sensemaking process. VIGOR contributes: (1) an exemplar-based interaction technique, where an analyst starts with a specific result and relaxes constraints to find other similar results or starts with only the structure (i.e., without node value constraints), and adds constraints to narrow in on specific results; and (2) a novel feature-aware subgraph result summarization. Through a collaboration with Symantec, we demonstrate how VIGOR helps tackle real-world problems through the discovery of security blindspots in a cybersecurity dataset with over 11,000 incidents. We also evaluate VIGOR with a within-subjects study, demonstrating VIGOR’s ease of use over a leading graph database management system, and its ability to help analysts understand their results at higher speed and make fewer errors.",,,,youtube -jeck0yrT_Q,,2018,2017,VAST,301-C,Tuesday,Graphs and Trees,5:15 PM,5:35 PM
VAST,TVCG,Visual Diagnosis of Tree Boosting Methods,"Jiannan Xiao, Junlin Liu, Xiting Wang, Jing Wu, Jun Zhu, Shixia Liu",http://shixialiu.com/publications/boostvis/paper.pdf,"Tree boosting, which combines weak learners (typically decision trees) to generate a strong learner, is a highly effective and widely used machine learning method. However, the development of a high performance tree boosting model is a time-consuming process that requires numerous trial-and-error experiments. To tackle this issue, we have developed a visual diagnosis tool, BOOSTVis, to help experts quickly analyze and diagnose the training process of tree boosting. In particular, we have designed a temporal confusion matrix visualization, and combined it with a t-SNE projection and a tree visualization. These visualization components work together to provide a comprehensive overview of a tree boosting model, and enable an effective diagnosis of an unsatisfactory training process. Two case studies that were conducted on the Otto Group Product Classification Challenge dataset demonstrate that BOOSTVis can provide informative feedback and guidance to improve understanding and diagnosis of tree boosting algorithms.",http://www.shixialiu.com:8082/static/index.html,,,video http://shixialiu.com/publications/boostvis/video.mp4,,2018,2017,VAST,102-ABC,Friday,ML3: Classification,8:50 AM,9:10 AM
VAST,TVCG,Visualizing Big Data Outliers through Distributed Aggregation,Leland Wilkinson,,,,,,,,2018,2017,VAST,301-C,Wednesday,High-dimensional Data,9:30 AM,9:50 AM
VAST,TVCG,Visualizing Confidence in Cluster-based Ensemble Weather Forecast Analyses,"Alexander Kumpf, Bianca Tost, Marlene Baumgart, Michael Riemer, Rüdiger Westermann, Marc Rautenhaus",https://wwwcg.in.tum.de/fileadmin/user_upload/Lehrstuehle/Lehrstuhl_XV/Research/Publications/2017/Cluster_Confidence/kumpf_etal_clustering_2017.pdf,"In meteorology, cluster analysis is frequently used to determine representative trends in ensemble weather predictions in a selected spatio-temporal region, e.g., to reduce a set of ensemble members to simplify and improve their analysis. Identified clusters (i.e., groups of similar members), however, can be very sensitive to small changes of the selected region, so that clustering results can be misleading and bias subsequent analyses. In this article, we –a team of visualization scientists and meteorologists– deliver visual analytics solutions to analyze the sensitivity of clustering results with respect to changes of a selected region. We propose an interactive visual interface that enables simultaneous visualization of a) the variation in composition of identified clusters (i.e., their robustness), b) the variability in cluster membership for individual ensemble members, and c) the uncertainty in the spatial locations of identified trends. We demonstrate that our solution shows meteorologists how representative a clustering result is, and with respect to which changes in the selected region it becomes unstable. Furthermore, our solution helps to identify those ensemble members which stably belong to a given cluster and can thus be considered similar. In a real-world application case we show how our approach is used to analyze the clustering behavior of different regions in a forecast of “Tropical Cyclone Karl”, guiding the user towards the cluster robustness information required for subsequent ensemble analysis",,,,vimeo 230830865,,2018,2017,VAST,301-C,Thursday,ML2: Cluster Analysis,4:15 PM,4:35 PM
VAST,TVCG,Visualizing Dataflow Graphs of Deep Learning Models in TensorFlow,"Kanit Wongsuphasawat, Daniel Smilkov, James Wexler, Jimbo Wilson, Dandelion Mané, Doug Fritz, Dilip Krishnan, Fernanda B. Viégas, Martin Wattenberg",https://idl.cs.washington.edu/files/2018-TensorFlowGraph-VAST.pdf,"We present a design study of the TensorFlow Graph Visualizer, part of the TensorFlow machine intelligence platform. This tool helps users understand complex machine learning architectures by visualizing their underlying dataflow graphs. The tool works by applying a series of graph transformations that enable standard layout techniques to produce a legible interactive diagram. To declutter the graph, we decouple non-critical nodes from the layout. To provide an overview, we build a clustered graph using the hierarchical structure annotated in the source code. To support exploration of nested structure on demand, we perform edge bundling to enable stable and responsive cluster expansion. Finally, we detect and highlight repeated structures to emphasize a model’s modular composition. To demonstrate the utility of the visualizer, we describe example usage scenarios and report user feedback. Overall, users find the visualizer useful for understanding, debugging, and sharing the structures of their models.",,,,vimeo 232930758,,2018,2017,Other,301-CD,Tuesday,VIS Awards & Best Papers,9:05 AM,9:25 AM
VAST,TVCG,Voila: Visual Anomaly Detection and Monitoring with Streaming Spatiotemporal Data,"Nan Cao, Chaoguang Lin, Qiuhan Zhu, Yu-Ru Lin, Xian Teng, Xidao Wen",,,,,,,,2018,2017,VAST,301-C,Tuesday,"Space, Time, Movement",2:20 PM,2:40 PM
VAST,VAST,A Visual Analytics System for Optimizing Communications in Massively Parallel Applications,"Takanori Fujiwara, Preeti Malakar, Khairi Reda, Venkatram Vishwanath, Michael Papka, Kwan-Liu Ma",,,,,,youtube RzXfxXjAoYk,,2017,2017,VAST,301-C,Thursday,Visual Representation and Design Study,8:50 AM,9:10 AM
VAST,VAST,A Workflow for Visual Diagnostics of Binary Classifiers using Instance-Level Explanations,"Josua Krause, Aritra Dasgupta, Jordan Swartz, Yindalon Aphinyanaphongs, Enrico Bertini",https://arxiv.org/pdf/1705.01968.pdf,"Human-in-the-loop data analysis applications necessitate greater transparency in machine learning models for experts to understand and trust their decisions. To this end, we propose a visual analytics workflow to help data scientists and domain experts explore, diagnose, and understand the decisions made by a binary classifier. The approach leverages “instance-level explanations”, measures of local feature relevance that explain single instances, and uses them to build a set of visual representations that guide the users in their investigation. The workflow is based on three main visual representations and steps: one based on aggregate statistics to see how data distributes across correct / incorrect decisions; one based on explanations to understand which features are used to make these decisions; and one based on raw data, to derive insights on potential root causes for the observed patterns. The workflow is derived from a long-term collaboration with a group of machine learning and healthcare professionals who used our method to make sense of machine learning models they developed. The case study from this collaboration demonstrates that the proposed workflow helps experts derive useful knowledge about the model and the phenomena it describes, thus experts can generate useful hypotheses on how a model can be improved.",,https://github.com/nyuvis/explanation_explorer,,vimeo 235631465,,2017,2017,VAST,102-ABC,Friday,ML3: Classification,9:10 AM,9:30 AM
VAST,VAST,CRICTO: Supporting Sensemaking through Crowdsourced Information Schematization,"Haeyong Chung, Sai Prashanth Dasari, Santhosh Nandhakumar, Christopher Andrews",,,,,,,,2017,2017,VAST,207,Thursday,Sensemaking,5:15 PM,5:35 PM
VAST,VAST,CrystalBall: A Visual Analytic System for Future Event Discovery and Analysis from Social Media Data,"Isaac Cho, Ryan Wesslen, Svitlana Volkova, Bill Ribarsky, Wenwen Dou",https://wesslen.github.io/assets/documents/papers/crystalball.pdf,"Social media data bear valuable insights regarding events that occur around the world. Events are inherently temporal and spatial. Existing visual text analysis systems have focused on detecting and analyzing past and ongoing events. Few have leveraged social media information to look for events that may occur in the future. In this paper, we present an interactive visual analytic system, CrystalBall, that automatically identifies and ranks future events from Twitter streams. CrystalBall integrates new methods to discover events with interactive visualizations that permit sensemaking of the identified future events. Our computational methods integrate seven different measures to identify and characterize future events, leveraging information regarding time, location, social networks, and the informativeness of the messages. A visual interface is tightly coupled with the computational methods to present a concise summary of the possible future events. A novel connection graph and glyphs are designed to visualize the characteristics of the future events. To demonstrate the efficacy of CrystalBall in identifying future events and supporting interactive analysis, we present multiple case studies and validation studies on analyzing events derived from Twitter data.",,,,vimeo 230830262,,2017,2017,VAST,301-C,Wednesday,Sequences and Events,2:40 PM,3:00 PM
VAST,VAST,E-Map: A Visual Analytics Approach for Exploring Significant Event Evolutions in Social Media,"Siming Chen, Shuai Chen, Lijing Lin, Xiaoru Yuan, Jie Liang, Xiaolong (Luke) Zhang",,,,,,,,2017,2017,VAST,301-C,Wednesday,Sequences and Events,3:00 PM,3:20 PM
VAST,VAST,Interactive Visual Alignment of Medieval Text Versions,"Stefan Jänicke, David Wrisley",,,,,,,,2017,2017,VAST,301-C,Thursday,Interaction in the Analysis Process,3:20 PM,3:40 PM
